{
  "structureVersion": 2,
  "shape": "decision",
  "grounded": true,
  "mapId": "map-tree-fixture",
  "nodes": [],
  "forks": [
    {
      "id": "ESAS-901-F1",
      "title": "Where the generator lives",
      "tickets": [
        "ESAS-901"
      ],
      "card": {
        "problem": "Which way?",
        "useCases": [
          "an owner answers"
        ],
        "options": [
          {
            "id": "A",
            "label": "A subcommand of design-map",
            "walks": [
              {
                "scenario": "the owner picks A",
                "text": "A is applied"
              }
            ],
            "rejectedBecause": "five units serialize on that file",
            "evidence": [
              "scripts/design-map.py"
            ]
          },
          {
            "id": "B",
            "label": "A new map-tree script",
            "walks": [
              {
                "scenario": "the owner picks B",
                "text": "B is applied"
              }
            ],
            "rejectedBecause": "two scripts to keep aligned"
          }
        ],
        "recommendation": {
          "option": "B",
          "why": "keeps design-map.py untouched"
        },
        "ifOverturned": "The other option replaces it."
      },
      "restsOn": [],
      "status": {
        "kind": "decided",
        "source": "owner",
        "option": "B"
      }
    },
    {
      "id": "ESAS-901-F2",
      "title": "How tamper is detected",
      "tickets": [
        "ESAS-901"
      ],
      "card": {
        "problem": "Which way?",
        "useCases": [
          "an owner answers"
        ],
        "options": [
          {
            "id": "A",
            "label": "Hash the body",
            "walks": [
              {
                "scenario": "the owner picks A",
                "text": "A is applied"
              }
            ],
            "rejectedBecause": "misses a moved map"
          },
          {
            "id": "B",
            "label": "Hash body and projection",
            "walks": [
              {
                "scenario": "the owner picks B",
                "text": "B is applied"
              }
            ]
          }
        ],
        "recommendation": {
          "option": "B",
          "why": "catches both kinds of drift"
        },
        "ifOverturned": "The other option replaces it."
      },
      "restsOn": [
        "ESAS-901-F1"
      ],
      "status": {
        "kind": "decided",
        "source": "recommendation",
        "option": "B"
      }
    },
    {
      "id": "ESAS-902-F1",
      "title": "Another ticket's fork",
      "tickets": [
        "ESAS-902"
      ],
      "card": {
        "problem": "Which way?",
        "useCases": [
          "an owner answers"
        ],
        "options": [
          {
            "id": "A",
            "label": "Alpha",
            "walks": [
              {
                "scenario": "the owner picks A",
                "text": "A is applied"
              }
            ]
          },
          {
            "id": "B",
            "label": "Beta",
            "walks": [
              {
                "scenario": "the owner picks B",
                "text": "B is applied"
              }
            ]
          }
        ],
        "recommendation": {
          "option": "A",
          "why": "alpha is enough"
        },
        "ifOverturned": "The other option replaces it."
      },
      "restsOn": [],
      "status": {
        "kind": "open"
      }
    },
    {
      "id": "ESAS-905-F1",
      "title": "Settled by a cited atom",
      "tickets": [
        "ESAS-905"
      ],
      "card": {
        "problem": "Which way?",
        "useCases": [
          "an owner answers"
        ],
        "options": [
          {
            "id": "A",
            "label": "Cite the atom",
            "walks": [
              {
                "scenario": "the owner picks A",
                "text": "A is applied"
              }
            ]
          },
          {
            "id": "B",
            "label": "Cite nothing",
            "walks": [
              {
                "scenario": "the owner picks B",
                "text": "B is applied"
              }
            ],
            "rejectedBecause": "prose is regenerated away"
          }
        ],
        "recommendation": {
          "option": "A",
          "why": "the citation outlives the prose"
        },
        "ifOverturned": "The other option replaces it."
      },
      "restsOn": [],
      "status": {
        "kind": "decided",
        "source": "owner",
        "option": "A",
        "resolvedBy": "atom:xp-0042"
      }
    },
    {
      "id": "ESAS-905-F2",
      "title": "Settled by the code",
      "tickets": [
        "ESAS-905"
      ],
      "card": {
        "problem": "Which way?",
        "useCases": [
          "an owner answers"
        ],
        "options": [
          {
            "id": "A",
            "label": "Use the new reader",
            "walks": [
              {
                "scenario": "the owner picks A",
                "text": "A is applied"
              }
            ]
          },
          {
            "id": "B",
            "label": "Keep the old reader",
            "walks": [
              {
                "scenario": "the owner picks B",
                "text": "B is applied"
              }
            ],
            "rejectedBecause": "the reader is already gone"
          }
        ],
        "recommendation": {
          "option": "A",
          "why": "the old reader is gone"
        },
        "ifOverturned": "The other option replaces it."
      },
      "restsOn": [],
      "status": {
        "kind": "decided",
        "source": "code",
        "option": "A"
      }
    },
    {
      "id": "ESAS-905-F3",
      "title": "Still open",
      "tickets": [
        "ESAS-905"
      ],
      "card": {
        "problem": "Which way?",
        "useCases": [
          "an owner answers"
        ],
        "options": [
          {
            "id": "A",
            "label": "Alpha",
            "walks": [
              {
                "scenario": "the owner picks A",
                "text": "A is applied"
              }
            ]
          },
          {
            "id": "B",
            "label": "Beta",
            "walks": [
              {
                "scenario": "the owner picks B",
                "text": "B is applied"
              }
            ]
          }
        ],
        "recommendation": {
          "option": "A",
          "why": "alpha is cheaper"
        },
        "ifOverturned": "The other option replaces it."
      },
      "restsOn": [],
      "status": {
        "kind": "open"
      }
    },
    {
      "id": "ESAS-905-F4",
      "title": "A question that stopped mattering",
      "tickets": [
        "ESAS-905"
      ],
      "card": {
        "problem": "Which way?",
        "useCases": [
          "an owner answers"
        ],
        "options": [
          {
            "id": "A",
            "label": "Alpha",
            "walks": [
              {
                "scenario": "the owner picks A",
                "text": "A is applied"
              }
            ]
          },
          {
            "id": "B",
            "label": "Beta",
            "walks": [
              {
                "scenario": "the owner picks B",
                "text": "B is applied"
              }
            ]
          }
        ],
        "recommendation": {
          "option": "A",
          "why": "alpha is enough"
        },
        "ifOverturned": "The other option replaces it."
      },
      "restsOn": [],
      "status": {
        "kind": "moot",
        "reason": "the feature was cut"
      }
    },
    {
      "id": "ESAS-905-F5",
      "title": "Waits on the cited fork",
      "tickets": [
        "ESAS-905"
      ],
      "restsOn": [
        "ESAS-905-F1"
      ],
      "status": {
        "kind": "open"
      }
    }
  ]
}
