{
  "structureVersion": 2,
  "shape": "decision",
  "grounded": true,
  "mapId": "map-tree-fixture",
  "nodes": [],
  "forks": [
    {
      "id": "ESAS-904-F1",
      "title": "The base question",
      "tickets": [
        "ESAS-904"
      ],
      "card": {
        "problem": "Which way?",
        "useCases": [
          "an owner answers"
        ],
        "options": [
          {
            "id": "A",
            "label": "Alpha",
            "walks": [
              {
                "scenario": "the owner picks A",
                "text": "A is applied"
              }
            ],
            "rejectedBecause": "too broad"
          },
          {
            "id": "B",
            "label": "Beta",
            "walks": [
              {
                "scenario": "the owner picks B",
                "text": "B is applied"
              }
            ]
          }
        ],
        "recommendation": {
          "option": "B",
          "why": "narrow"
        },
        "ifOverturned": "The other option replaces it."
      },
      "restsOn": [],
      "status": {
        "kind": "decided",
        "source": "owner",
        "option": "B"
      }
    },
    {
      "id": "ESAS-904-F2",
      "title": "Depends on the base",
      "tickets": [
        "ESAS-904"
      ],
      "restsOn": [
        "ESAS-904-F1"
      ],
      "status": {
        "kind": "open"
      }
    },
    {
      "id": "ESAS-904-F3",
      "title": "Cut before it was carded",
      "tickets": [
        "ESAS-904"
      ],
      "restsOn": [
        "ESAS-904-F1"
      ],
      "status": {
        "kind": "moot",
        "reason": "the branch was dropped"
      }
    }
  ]
}
